<?xml version="1.0" encoding="UTF-8" standalone="yes"?>
<?xml-stylesheet type='text/xsl' href="../NLCSValidatieRegels.xsl"?>
<NLCSValidatieregels xmlns:xsi="http://www.w3.org/2001/XMLSchema-instance"
		     xsi:schemaLocation="NLCSValidatieRegelsNameSpace ../NLCSValidatieRegels.xsd"
		     xmlns="NLCSValidatieRegelsNameSpace">
	<validatieRegels>
		<validatieRegel nummer="R.1" naam="Bestand bevat NLCS Objecten">
			<beschrijving>Het NLCS++ bestand moet één of meerdere NLCS++ objecten bevatten</beschrijving>
			<soort>Bestand</soort>
			<definitie>
				Een NLCS++ bestand moet een AProjectReferentie hebben waarin tenminste 1 NLCS Object zit.
			</definitie>
			<toelichting>Er mag geen 'leeg' project ingeleverd worden, oftewel met alleen maar één Aprojectreferentie</toelichting>
			<validatieObjecten>
				<validatieObject><naam>Document</naam></validatieObject>
			</validatieObjecten>
		</validatieRegel>
		<validatieRegel nummer="R.2" naam="Combinatie NLCS Status en Tekeningsoort">
			<beschrijving>Afhankelijk van het Tekeningsoort mogen er NLCS Objecten voorkomen met bepaalde NLCS Statussen</beschrijving>
			<soort>Bestand</soort>
			<definitie>
				Bestaande Situatie: BESTAAND
				Definitief Ontwerp: BESTAAND, NIEUW, REVISIE en VERWIJDERD
				Deelrevisie: BESTAAND, NIEUW, REVISIE en VERWIJDERD
				Eindrevisie: BESTAAND, NIEUW, REVISIE en VERWIJDERD
			</definitie>
			<validatieObjecten>
				<validatieObject><naam>Document</naam></validatieObject>
			</validatieObjecten>
		</validatieRegel>
		<validatieRegel nummer="R.3" naam="Geometrie binnen Projectvlak">
			<beschrijving>Iedere geometrie (punt, lijn en vlak) van ieder NLCS Object in het bestand moet interactie hebben met het Projectgebied van AProjectReferentie</beschrijving>
			<soort>Geometrie</soort>
			<definitie>
				Het kenmerk Geometry (gml:Point, gml:Curve of gml:Surface) moet interactie hebben met de Geometry (gml:Surface) van de AprojectReferentie
			</definitie>
			<validatieObjecten>
				<validatieObject><naam>Aaanlegtechniek</naam></validatieObject>
				<validatieObject><naam>AbeschermingVlak</naam></validatieObject>
				<validatieObject><naam>Akunstwerk</naam></validatieObject>
				<validatieObject><naam>Amantelbuis</naam></validatieObject>
				<validatieObject><naam>Eaarddraad</naam></validatieObject>
				<validatieObject><naam>Eaardpen</naam></validatieObject>
				<validatieObject><naam>LSkabel</naam></validatieObject>
				<validatieObject><naam>LSmof</naam></validatieObject>
				<validatieObject><naam>LSoverdrachtspunt</naam></validatieObject>
				<validatieObject><naam>MSkabel</naam></validatieObject>
		    	<validatieObject><naam>MSmof</naam></validatieObject>
		    	<validatieObject><naam>MSoverdrachtspunt</naam></validatieObject>
				<validatieObject><naam>MSstation</naam></validatieObject>
				<validatieObject><naam>OVLoverdrachtspunt</naam></validatieObject>
		    </validatieObjecten>
		</validatieRegel>
		<validatieRegel nummer="R.4" naam="Lijn Geometrie">
			<beschrijving>Een lijn en de omtrek van vlak moeten voldoen aan inmeeteisen</beschrijving>
			<soort>Geometrie</soort>
			<definitie>
				Een gml:Curve moet voldoen aan de volgende inmeeteisen:
					- minimale (10cm) en maximale (50m) afstand van (inmeet)punten
					- mag geen knikken bevatten: hoek tussen segmenten > 45 graden.

				Een gml:Surface moet voldoen aan de volgende definitie:
					- minimale (10cm) en maximale (50m) afstand van (inmeet)punten

				Note: Voor Aanlegtechnieken, kabels en mantelbuizen binnen 1 meter wordt alleen de hoek van lijnsegmenten gecheckt. Zie R.43 voor meer details
			</definitie>
			<validatieObjecten>
			     <!-- Deze regel geldt voor alle NLCS Objecten met een gml:Curve-->
				<validatieObject><naam>Aaanlegtechniek</naam></validatieObject>
				<validatieObject><naam>Amantelbuis</naam></validatieObject>
				<validatieObject><naam>Eaarddraad</naam></validatieObject>
				<validatieObject><naam>LSkabel</naam></validatieObject>
				<validatieObject><naam>MSkabel</naam></validatieObject>
				<validatieObject><naam>MSstation</naam></validatieObject>

				<!--
				<validatieObject><naam>HSkabel</naam></validatieObject>
				<validatieObject><naam>Gleiding</naam></validatieObject>
				<validatieObject><naam>KBmeetdraad</naam></validatieObject>
				<validatieObject><naam>Tkabel</naam></validatieObject>
				<validatieObject><naam>Tbuis</naam></validatieObject>
				<validatieObject><naam>Eoliedrukleiding</naam></validatieObject>
				<validatieObject><naam>Akunstwerk</naam></validatieObject>
				<validatieObject><naam>LSkast</naam></validatieObject>
				<validatieObject><naam>HSstation</naam></validatieObject>
				<validatieObject><naam>Gstation</naam></validatieObject>
				<validatieObject><naam>Tstation</naam></validatieObject>
				<validatieObject><naam>AbeschermingVlak</naam></validatieObject>
				 -->
			</validatieObjecten>
		</validatieRegel>
		<validatieRegel nummer="R.5" naam="GisId en AssetId">
			<beschrijving>Ieder NLCS Object met de status BESTAAND, REVISIE en VERWIJDERD moet een GisId en AssetId hebben, dit zijn namelijk objecten die als oorsprong de assetregistratie hebben. NLCS objecten met de status NIEUW mogen juist geen GisId en AssetId hebben omdat deze objecten ontstaan in het ontwerp of de revisie.</beschrijving>
			<soort>Verplichte waarde</soort>
			<definitie>
				Als Status = BESTAAND, REVISIE of VERWIJDERD, dan moet er een waarde zijn voor zowel kenmerk GisId als AssetId,
				Als Status = NIEUW dan moeten de kenmerken GisId en AssetId leeg zijn
			</definitie>
			<toelichting>Een AmantelbuisInhoud heeft nooit een GisId.</toelichting>
		    <validatieObjecten> <!-- Deze regel geldt voor alle NLCS Objecten -->
		    	<validatieObject><naam>AlleObjecten</naam></validatieObject>
		    </validatieObjecten>
		</validatieRegel>
		<validatieRegel nummer="R.6" naam="Inmeetwijze en Nauwkeurigheid Lineaire Assets Elec">
			<beschrijving>Ieder lineair NLCS Object voor Elec moet waardes hebben voor de kenmerken Inmeetwijze en Nauwkeurigheid.</beschrijving>
			<soort>Verplichte waarde</soort>
			<definitie>
				Ieder lineair NLCS Object voor Elec moet waardes hebben voor de kenmerken Inmeetwijze en Nauwkeurigheid.
			</definitie>
			<validatieObjecten>
				<validatieObject><naam>Amantelbuis</naam></validatieObject>
				<validatieObject><naam>Eaarddraad</naam></validatieObject>
				<validatieObject><naam>LSkabel</naam></validatieObject>
				<validatieObject><naam>MSkabel</naam></validatieObject>
				<!--
				<validatieObject><naam>HSkabel</naam></validatieObject>
				 -->
			</validatieObjecten>
		</validatieRegel>
		<validatieRegel nummer="R.7" naam="Subnettype gevuld voor LS en MS Kabel">
			<beschrijving>MSkabel, LSkabel en LSmof moeten een waarde hebben voor Subnettype.</beschrijving>
			<soort>Verplichte waarde</soort>
			<definitie>
				MSkabel, LSkabel en LSmof moeten een waarde hebben voor kenmerk Subnettype.
			</definitie>
			<validatieObjecten>
				<validatieObject><naam>MSkabel</naam></validatieObject>
				<validatieObject><naam>LSkabel</naam></validatieObject>
				<validatieObject><naam>LSmof</naam></validatieObject>
			</validatieObjecten>
		</validatieRegel>
		<validatieRegel nummer="R.8" naam="Verplichte kenmerken Kabels">
			<beschrijving>Iedere kabel heeft kenmerken die gevuld moeten zijn.</beschrijving>
			<soort>Verplichte waarde</soort>
			<definitie>
				Iedere kabel moet een waarde voor de volgende kenmerken hebben:
					- Uitvoering
					- Kabelopbouw
					- Fabrikant
					- Verbindingnummer
					- Spanningsniveau
					- FaseAanduiding
					Voor LSkabel objecten zijn er nog 3 extra kenmerken die gevuld moeten zijn:
					- Aardingsysteem
					- Bovengronds
					- Functie
				N.B. Als het kenmerk Uitvoering de waarde "KEUZE ONTBREEKT IN LIJST" dan moet het kenmerk OmschrijvingUitvoering gevuld zijn!
			</definitie>
			<validatieObjecten>
				<validatieObject><naam>HSkabel</naam></validatieObject>
				<validatieObject><naam>LSkabel</naam></validatieObject>
				<validatieObject><naam>MSkabel</naam></validatieObject>
			</validatieObjecten>
		</validatieRegel>
		<validatieRegel nummer="R.9" naam="Aanlegdatum gevuld">
			<beschrijving>De aanlegdatum moet gevuld zijn en mag niet in de toekomst liggen.</beschrijving>
			<soort>Verplichte waarde</soort>
			<definitie>
				De aanlegdatum moet gevuld zijn en de gevulde datum mag niet in de toekomst liggen.
			</definitie>
			<validatieObjecten> <!-- Deze regel geldt voor alle NLCS Objecten van Elec -->
				<validatieObject><naam>Eaarddraad</naam></validatieObject>
				<validatieObject><naam>Eaardpen</naam></validatieObject>
				<validatieObject><naam>LSkabel</naam></validatieObject>
				<validatieObject><naam>LSmof</naam></validatieObject>
				<validatieObject><naam>LSoverdrachtspunt</naam></validatieObject>
				<validatieObject><naam>MSstation</naam></validatieObject>
				<validatieObject><naam>MSkabel</naam></validatieObject>
				<validatieObject><naam>MSmof</naam></validatieObject>
				<validatieObject><naam>MSoverdrachtspunt</naam></validatieObject>
				<validatieObject><naam>OVLoverdrachtspunt</naam></validatieObject>
				<!--
				<validatieObject><naam>LSkast</naam></validatieObject>
				<validatieObject><naam>HSstation</naam></validatieObject>
				<validatieObject><naam>HSkabel</naam></validatieObject>
				<validatieObject><naam>HSmof</naam></validatieObject>
				 -->
			</validatieObjecten>
		</validatieRegel>
		<validatieRegel nummer="R.10" naam="Verplichte kenmerken moffen">
			<beschrijving>Iedere mof heeft kenmerken die gevuld moeten zijn.</beschrijving>
			<soort>Verplichte waarde</soort>
			<definitie>
				Iedere mof moet een waarde voor de volgende kenmerken hebben:
					- Functie
					- Verbindingnummer